Product Name,Category,Specifications,Existing Descriptions
UltraBoost Running Shoes,Footwear,"Lightweight, breathable mesh upper, responsive Boost midsole, Continental rubber outsole","""Experience the ultimate running experience with these high-performance shoes."""
Ninja Foodi Air Fryer,Kitchen Appliances,"8-in-1 functionality, XL capacity, dehydrate function, dishwasher-safe parts","""Cook up a storm with this versatile air fryer that does it all."""
Samsung Galaxy S23 Ultra,Smartphones,"6.8"" Dynamic AMOLED display, 200MP main camera, 100x Space Zoom, S Pen support","""Capture stunning photos and unleash your creativity with this powerful smartphone."""
Sony WH-1000XM5 Wireless Headphones,Electronics,"Industry-leading noise cancellation, 30-hour battery life, comfortable fit, touch controls","""Immerse yourself in your music and block out the world with these premium headphones."""
Casper Original Mattress,Furniture,"Breathable foam construction, Zoned Support™ for pressure relief, CertiPUR-US® certified","""Enjoy a cool, comfortable sleep and wake up feeling refreshed on this award-winning mattress."""
Patagonia Better Sweater Fleece Jacket,Clothing,"Recycled polyester fleece, Fair Trade Certified™ sewn, bluesign® approved","""Stay warm and cozy while reducing your environmental impact with this sustainable fleece jacket."""
YETI Rambler 20 oz Tumbler,Outdoor Gear,"Double-wall vacuum insulation, 18/8 stainless steel, No Sweat™ Design, dishwasher safe","""Keep your drinks hot or cold for hours with this durable and stylish tumbler."""
Kindle Paperwhite (11th Gen),Electronics,"6.8"" glare-free display, adjustable warm light, waterproof, 10-week battery life","""Lose yourself in a good book anytime, anywhere with this lightweight and waterproof e-reader."""
Dyson V15 Detect Cordless Vacuum,Appliances,"Laser detects microscopic dust, whole-machine HEPA filtration, LCD screen, up to 60 mins run time","""Uncover hidden dust and allergens with this intelligent and powerful cordless vacuum."""
Apple iPad Air (5th Gen),Electronics,"10.9"" Liquid Retina display, M1 chip, 12MP Ultra Wide front camera, Magic Keyboard support","""Unleash your productivity and creativity on this versatile and portable tablet."""
LEGO Creator Expert Taj Mahal,Toys & Games,"5,923 pieces, intricate details, iconic landmark replica","""Build a masterpiece and showcase your passion for architecture with this challenging LEGO set."""
Peloton Bike+,Fitness Equipment,"23.8"" HD touchscreen, Auto Follow resistance, immersive sound system, access to live & on-demand classes","""Transform your home into a cycling studio and achieve your fitness goals with this interactive bike."""
Vitamix Ascent Series A3500 Blender,Kitchen Appliances,"10-variable speeds, 64-oz container, programmable timer, self-cleaning function","""Create smoothies, soups, and more with this powerful and versatile blender."""
Roomba j7+ Robot Vacuum,Appliances,"PrecisionVision Navigation, avoids obstacles, empties itself, voice control compatible","""Enjoy a cleaner home without lifting a finger with this intelligent and self-emptying robot vacuum."""
GoPro HERO11 Black,Electronics,"5.3K60 video, 27MP photos, HyperSmooth 5.0 stabilization, waterproof to 33ft","""Capture your adventures in stunning detail with this versatile and rugged action camera."""
Ooni Koda 16 Gas Pizza Oven,Outdoor Gear,"Reaches 950°F in 20 mins, cooks 16"" pizzas, portable design, gas-powered","""Enjoy authentic wood-fired pizza in your backyard with this easy-to-use outdoor oven."""
L.L.Bean Wicked Good Slippers,Clothing,"Premium sheepskin, shearling lining, durable outsole, handcrafted in Maine","""Treat your feet to ultimate comfort and warmth with these iconic slippers."""
Nintendo Switch OLED Model,Video Games,"7-inch OLED screen, enhanced audio, wider adjustable stand, 64GB internal storage","""Experience vivid colors and immersive gameplay on this upgraded console."""
Le Creuset Signature Enameled Cast Iron Round Dutch Oven,Kitchen Appliances,"5.5-quart capacity, superior heat retention, chip-resistant enamel, lifetime warranty","""Create culinary masterpieces and enjoy years of reliable performance with this iconic Dutch oven."""
Bose QuietComfort 35 II Wireless Headphones,Electronics,"World-class noise cancellation, 20-hour battery life, Alexa-enabled, comfortable fit","""Focus on your work or relax with your favorite music, undisturbed by the world around you."""